prices,white_bread_Product,Bread_size
$329,Sara Lee Butter Bread,20 oz
$439,Sara Lee White made with Whole Wheat Bread,20 oz
$439,Sara Lee 100% Whole Wheat Bread,20 oz
$409,"Nature's Own Perfectly Crafted White Bread, Thick Sliced Non-GMO Sandwich Bread, 22 oz Loaf",22 oz
$689,"Dave's Killer Bread White Bread Done Right, Artisan-Style Organic White Bread, 24 oz Loaf",24 oz
$439,Pepperidge Farm Farmhouse Hearty White Bread,24 oz
$329,"Nature's Own Butterbread, Sliced White Bread, 20 oz Loaf",20 oz
$319,Pepperidge Farm® Italian Italian with Sesame Seeds Bread,20 oz
$329,Sara Lee Artesano Bakery Bread,20 oz
$329,Sara Lee Butter Bread,20 oz
$439,Sara Lee White made with Whole Wheat Bread,20 oz
$409,"Nature's Own Perfectly Crafted White Bread, Thick Sliced Non-GMO Sandwich Bread, 22 oz Loaf",22 oz
$689,"Dave's Killer Bread White Bread Done Right, Artisan-Style Organic White Bread, 24 oz Loaf",24 oz
$329,"Nature's Own Butterbread, Sliced White Bread, 20 oz Loaf",20 oz
$439,Pepperidge Farm Farmhouse Hearty White Bread,24 oz
$409,Nature's Own Perfectly Crafted Thick Sliced Brioche Style Bread,22 oz
$439,Pepperidge Farm Farmhouse Whole Grain White Bread,24 oz
$319,Pepperidge Farm® Italian Italian with Sesame Seeds Bread,20 oz
$439,Sara Lee 100% Whole Wheat Bread,20 oz
$499,Thomas’ Light Multi-Grain English Muffins,6 x 13 oz
$499,Arnold Whole Grains 100% Whole Wheat Bread,24 oz
$439,Sara Lee White made with Whole Wheat Bread,20 oz
$689,Dave's Killer Bread 21 Whole Grains and Seeds Organic Bread,27 oz
$439,Pepperidge Farm Farmhouse Butter Bread,22 oz
