prices,white_bread_Product,Bread_size
$419,Sara Lee Classic White Bread,20 oz
$469,Sara Lee Butter Bread,20 oz
$899,"Dave's Killer Bread White Bread Done Right, Artisan-Style Organic White Bread, 24 oz Loaf",24 oz
$599,Arnold Brick Oven Premium White Bread,20 oz
$709,Arnold Brick Oven Premium White Bread,32 oz
$599,Arnold Country White Bread,24 oz
$539,Pepperidge Farm® White White Bread,16 oz
$449,Pepperidge Farm® White Original White Bread,16 oz
$539,Pepperidge Farm® Very Thin Enriched White Thin Sliced Bread,16 oz
$469,Sara Lee White made with Whole Wheat Bread,20 oz
$509,Sara Lee Artesano Bakery Bread,20 oz
$599,Thomas’ Toast-R-Cakes Corn Muffins,6 x 7 oz
$559,Pepperidge Farm Farmhouse Hearty White Bread,24 oz
$379,Pepperidge Farm Italian White Seedless Bread,20 oz
$419,Sara Lee Classic White Bread,20 oz
$899,Dave's Killer Bread Powerseed Organic Bread,25 oz
$619,The Rustik Oven Artisan Pane Italiano Bread,16 oz
$559,Pepperidge Farm Farmhouse Butter Bread,22 oz
$619,Medina State Inc Country Bread,20 ct
$509,Sara Lee Honey Wheat Bread,20 oz
$599,Thomas’ Original English Muffins,12 oz
$599,Arnold Whole Grains 100% Whole Wheat Bread,24 oz
$509,Sara Lee Artesano Bakery Bread,20 oz
$469,Sara Lee White made with Whole Wheat Bread,20 oz
